{
  "timestamp": "08-02-26 07-38",
  "messageCount": 1,
  "decisionCount": 4,
  "diagramCount": 0,
  "skillVersion": "1.7.2",
  "autoTriggered": false,
  "filtering": {
    "totalProcessed": 0,
    "noise_filtered": 0,
    "duplicates_removed": 0,
    "quality_score": 100,
    "filtered": {
      "noise": 0,
      "empty": 0,
      "duplicate": 0,
      "low_quality": 0
    }
  },
  "semanticSummary": {
    "task": "Development session",
    "filesCreated": 0,
    "filesModified": 4,
    "decisions": 0,
    "messageStats": {
      "intent": 0,
      "plan": 0,
      "implementation": 1,
      "result": 0,
      "decision": 0,
      "total": 1
    }
  },
  "embedding": {
    "status": "indexed",
    "model": "nomic-ai/nomic-embed-text-v1.5",
    "dimensions": 768,
    "memoryId": 2,
    "generatedAt": "2026-02-08T06:38:06.725Z"
  }
}