{
  "timestamp": "24-12-25 15-45",
  "messageCount": 13,
  "decisionCount": 0,
  "diagramCount": 0,
  "skillVersion": "11.2.0",
  "autoTriggered": false,
  "filtering": {
    "totalProcessed": 0,
    "noiseFiltered": 0,
    "duplicatesRemoved": 0,
    "qualityScore": 100,
    "filtered": {
      "noise": 0,
      "empty": 0,
      "duplicate": 0,
      "lowQuality": 0
    }
  },
  "semanticSummary": {
    "task": "Development session",
    "filesCreated": 0,
    "filesModified": 5,
    "decisions": 0,
    "messageStats": {
      "intent": 0,
      "plan": 0,
      "implementation": 2,
      "result": 0,
      "decision": 0,
      "total": 13
    }
  },
  "embedding": {
    "status": "indexed",
    "model": "nomic-ai/nomic-embed-text-v1.5",
    "dimensions": 768,
    "memoryId": 139,
    "generatedAt": "2025-12-24T14:45:41.543Z",
    "triggerPhrases": [
      "consistent error",
      "error handling",
      "bug fixes",
      "importance tier",
      "trigger phrases"
    ],
    "importanceWeight": 1
  }
}