{
  "timestamp": "11-02-26 14-19",
  "messageCount": 20,
  "decisionCount": 0,
  "diagramCount": 1,
  "skillVersion": "1.7.2",
  "autoTriggered": true,
  "filtering": {
    "totalProcessed": 20,
    "noiseFiltered": 0,
    "duplicatesRemoved": 10,
    "qualityScore": 31,
    "filtered": {
      "noise": 0,
      "empty": 0,
      "duplicate": 10,
      "lowQuality": 0
    }
  },
  "semanticSummary": {
    "task": "Release for agent updates only (mirror 1",
    "filesCreated": 0,
    "filesModified": 3,
    "decisions": 0,
    "messageStats": {
      "intent": 1,
      "plan": 1,
      "implementation": 0,
      "result": 0,
      "decision": 0,
      "total": 20
    }
  },
  "embedding": {
    "status": "indexed",
    "model": "nomic-ai/nomic-embed-text-v1.5",
    "dimensions": 768,
    "memoryId": 7,
    "generatedAt": "2026-02-11T13:19:10.867Z"
  }
}