{
  "timestamp": "24-12-25 12-06",
  "messageCount": 6,
  "decisionCount": 0,
  "diagramCount": 0,
  "skillVersion": "11.2.0",
  "autoTriggered": false,
  "filtering": {
    "totalProcessed": 0,
    "noiseFiltered": 0,
    "duplicatesRemoved": 0,
    "qualityScore": 100,
    "filtered": {
      "noise": 0,
      "empty": 0,
      "duplicate": 0,
      "lowQuality": 0
    }
  },
  "semanticSummary": {
    "task": "Fixing API keys, bugs, and MCP server issues",
    "filesCreated": 0,
    "filesModified": 8,
    "decisions": 0,
    "messageStats": {
      "intent": 2,
      "plan": 0,
      "implementation": 0,
      "result": 0,
      "decision": 0,
      "total": 6
    }
  },
  "embedding": {
    "status": "indexed",
    "model": "nomic-ai/nomic-embed-text-v1.5",
    "dimensions": 768,
    "memoryId": 129,
    "generatedAt": "2025-12-24T11:06:32.819Z",
    "triggerPhrases": [
      "comprehensive bug",
      "tier bug",
      "bug fix",
      "context template",
      "tool catalog"
    ],
    "importanceWeight": 1
  }
}