{
  "timestamp": "01-01-26 15-02",
  "messageCount": 1,
  "decisionCount": 5,
  "diagramCount": 0,
  "skillVersion": "12.5.0",
  "autoTriggered": false,
  "filtering": {
    "totalProcessed": 0,
    "noiseFiltered": 0,
    "duplicatesRemoved": 0,
    "qualityScore": 100,
    "filtered": {
      "noise": 0,
      "empty": 0,
      "duplicate": 0,
      "lowQuality": 0
    }
  },
  "semanticSummary": {
    "task": "Development session",
    "filesCreated": 1,
    "filesModified": 0,
    "decisions": 0,
    "messageStats": {
      "intent": 0,
      "plan": 0,
      "implementation": 1,
      "result": 0,
      "decision": 0,
      "total": 1
    }
  },
  "embedding": {
    "status": "pending",
    "model": "nomic-ai/nomic-embed-text-v1.5",
    "dimensions": 768
  }
}