{
  "timestamp": "21-12-25 11-16",
  "messageCount": 1,
  "decisionCount": 4,
  "diagramCount": 0,
  "skillVersion": "11.2.0",
  "autoTriggered": false,
  "filtering": {
    "totalProcessed": 0,
    "noiseFiltered": 0,
    "duplicatesRemoved": 0,
    "qualityScore": 100,
    "filtered": {
      "noise": 0,
      "empty": 0,
      "duplicate": 0,
      "lowQuality": 0
    }
  },
  "semanticSummary": {
    "task": "Implemented a CMS-driven alert/notification system for A",
    "filesCreated": 0,
    "filesModified": 0,
    "decisions": 0,
    "messageStats": {
      "intent": 1,
      "plan": 0,
      "implementation": 0,
      "result": 0,
      "decision": 0,
      "total": 1
    }
  },
  "embedding": {
    "status": "indexed",
    "model": "nomic-ai/nomic-embed-text-v1.5",
    "dimensions": 768,
    "memoryId": 72,
    "generatedAt": "2025-12-21T10:16:10.682Z",
    "triggerPhrases": [
      "when empty",
      "without empty",
      "empty notification",
      "empty timestamp",
      "empty trade"
    ],
    "importanceWeight": 1
  }
}