{
  "timestamp": "25-01-26 11-24",
  "messageCount": 13,
  "decisionCount": 5,
  "diagramCount": 0,
  "skillVersion": "1.7.2",
  "autoTriggered": false,
  "filtering": {
    "total_processed": 0,
    "noise_filtered": 0,
    "duplicates_removed": 0,
    "quality_score": 100,
    "filtered": {
      "noise": 0,
      "empty": 0,
      "duplicate": 0,
      "low_quality": 0
    }
  },
  "semanticSummary": {
    "task": "JavaScript Codebase Remediation - P0 Cleanup Functions and Snake_Case Standardization",
    "filesCreated": 3,
    "filesModified": 26,
    "decisions": 5,
    "messageStats": {
      "intent": 0,
      "plan": 0,
      "implementation": 0,
      "result": 0,
      "decision": 0,
      "total": 13
    }
  },
  "embedding": {
    "status": "indexed",
    "model": "nomic-ai/nomic-embed-text-v1.5",
    "dimensions": 768,
    "memoryId": 212,
    "generatedAt": "2026-01-25T10:24:16.698Z"
  }
}