{
  "timestamp": "16-01-26 16-09",
  "messageCount": 20,
  "decisionCount": 3,
  "diagramCount": 0,
  "skillVersion": "12.5.0",
  "autoTriggered": true,
  "filtering": {
    "total_processed": 0,
    "noise_filtered": 0,
    "duplicates_removed": 0,
    "quality_score": 100,
    "filtered": {
      "noise": 0,
      "empty": 0,
      "duplicate": 0,
      "low_quality": 0
    }
  },
  "semanticSummary": {
    "task": "Memory & Folder Ranking Implementation Validation",
    "filesCreated": 1,
    "filesModified": 8,
    "decisions": 3,
    "messageStats": {
      "intent": 0,
      "plan": 0,
      "implementation": 0,
      "result": 0,
      "decision": 0,
      "total": 20
    }
  },
  "embedding": {
    "status": "pending",
    "model": "nomic-ai/nomic-embed-text-v1.5",
    "dimensions": 768
  }
}